,source,author,title,description,url,urlToImage,publishedAt,content
97,"{'id': None, 'name': 'Beststocks.com'}",Roberto Liccardo,SK Telecom Company Limited (NYSE:SKM) StockNews.com has ... - Best Stocks,"In a report made available for public consumption on Saturday, StockNews.com advised its readers to ""buy"" shares of SK Telecom",https://beststocks.com/sk-telecom-company-limited-nyseskm-stocknews-c-3/,https://beststocks.com/wp-content/uploads/2022/07/Dow-Jones-DJIA.jpg,2022-12-25T10:49:21Z,"In a report made available for public consumption on Saturday, StockNews.com advised its readers to “buy” shares of SK Telecom Co., Ltd. (NYSE: SKM). A “hold” rating had been assigned to the company … [+4129 chars]"
98,"{'id': None, 'name': 'Sputnik International'}",Muhammad Osman,Researchers Recreate Two Facial Depictions of Egyptian Pharaoh Ramses II Using CT Scan Technology,"Pharaoh Ramses II belongs to the nineteenth dynasty in Ancient Egypt, where his rule extended between 1279 and 1212 BC. Nicknamed by his successors and subsequent rulers as the great-grandfather, Ramses II is considered the most famous and most powerful phara…",https://sputniknews.com/20221225/researchers-recreate-two-facial-depictions-of-egyptian-pharaoh-ramses-ii-using-ct-scan-technology-1105780761.html,https://cdnn1.img.sputniknews.com/images/sharing/article/eng/1105780761.jpg?11057805791671964836,2022-12-25T10:40:19Z,"Get the latest Africa news from Sputnik: breaking news, photos, videos, analysis, and features.
https://sputniknews.com/20221225/researchers-recreate-two-facial-depictions-of-egyptian-pharaoh-ramses… [+6289 chars]"
99,"{'id': None, 'name': 'Freerepublic.com'}",The Sun UK,FESTIVE FLIX Secret codes to unlock the hidden Christmas movie genres on Netflix revealed,"NETFLIX has so much Christmas content that it's hard to know where to start. Even if you do scroll down and find a Christmas movie genre, it might not be right for you. Netflix actually have a series of not-so secret codes that will instantly transport you to…",https://freerepublic.com/focus/f-chat/4118796/posts,,2022-12-25T10:37:46Z,"Skip to comments.
FESTIVE FLIX Secret codes to unlock the hidden Christmas movie genres on Netflix revealedThe Sun UK ^
 | 24 Dec 2022
 | Jamie Harris, Senior Technology and Science Reporter
Post… [+1572 chars]"
