,source,author,title,description,url,urlToImage,publishedAt,content
32,"{'id': None, 'name': 'Vox'}",Izzie Ramirez,9 breakthroughs this year that gave us hope for the future,"From climate to housing, these policy and science wins suggest that 2022 was full of progress.",https://www.vox.com/future-perfect/23517558/policy-science-2022-vaccines-inflation-reduction-act-guaranteed-income,https://cdn.vox-cdn.com/thumbor/8nXveqf_gU18lUV0sLJNbl0N2Xk=/0x215:3000x1786/fit-in/1200x630/cdn.vox-cdn.com/uploads/chorus_asset/file/24303487/fp19.jpg,2022-12-25T13:00:00Z,"From climate to housing, these policy and science wins suggest that 2022 was full of progress. 2022 wasn’t as defined by the coronavirus pandemic as 2020 or 2021, but it was still marred by its fallo… [+18163 chars]"
33,"{'id': 'the-times-of-india', 'name': 'The Times of India'}",AP,China's COVID-19 surge raises odds of new coronavirus mutant,"""China has a population that is very large and there's limited immunity. And that seems to be the setting in which we may see an explosion of a new variant,"" said Dr. Stuart Campbell Ray, an infectious disease expert at Johns Hopkins University.",https://economictimes.indiatimes.com/news/international/world-news/chinas-covid-19-surge-raises-odds-of-new-coronavirus-mutant/articleshow/96498156.cms,"https://img.etimg.com/thumb/msid-96498207,width-1070,height-580,imgsize-81102,overlay-economictimes/photo.jpg",2022-12-25T12:56:06Z,Beijing: Could the COVID-19 surge in China unleash a new coronavirus mutant on the world? Scientists don't know but worry that might happen. It could be similar to omicron variants circulating there … [+3749 chars]
34,"{'id': None, 'name': 'Space Daily'}",,NASA begins construction on asteroid-detecting space telescope,"Washington DC (UPI) Dec 23, 2021


 Construction is set to begin on NASA's Near-Earth Object Surveyor, a space telescope designed to search for hard-to-find comets and asteroids that approach the area near Earth. 
 The NEO Surveyor passed a technical programm…",https://www.spacedaily.com/reports/NASA_begins_construction_on_asteroid-detecting_space_telescope_999.html,https://www.spxdaily.com/images-hg/asteroid-spix-hg.jpg,2022-12-25T12:50:54Z,"Construction is set to begin on NASA's Near-Earth Object Surveyor, a space telescope designed to search for hard-to-find comets and asteroids that approach the area near Earth.
The NEO Surveyor pass… [+2751 chars]"
35,"{'id': 'the-times-of-india', 'name': 'The Times of India'}",ET Spotlight Special,"Oneplus 11 5G images leaked online: Should you wait to buy this, find out here","Oneplus 11 5G images have been leaked online, giving users a sense of how the design looks like. As per reports, it may have a 50MP main back camera and a QHD+ display",https://economictimes.indiatimes.com/news/new-updates/oneplus-11-5g-images-leaked-online-should-you-wait-to-buy-this-find-out-here/articleshow/96497960.cms,"https://img.etimg.com/thumb/msid-96498058,width-1070,height-580,imgsize-20204,overlay-economictimes/photo.jpg",2022-12-25T12:49:37Z,"The upcoming OnePlus 11 smartphone has been generating buzz in the tech world, with various rumours and leaks emerging about its features and specifications. According to recent reports, the device h… [+2790 chars]"
36,"{'id': None, 'name': 'Business Standard'}",Press Trust of India,India needs corporate mandate on R&D: Zoho CEO Sridhar Vembu,"India requires a corporate mandate on Research & Development similar to CSR to promote a technology innovation culture which will help build critical technologies here in the country, Zoho Corporation's founder Sridhar Vembu said.
The Padma Shree awardee and …",https://www.business-standard.com/article/companies/india-needs-corporate-mandate-on-r-d-zoho-ceo-sridhar-vembu-122122500525_1.html,https://bsmedia.business-standard.com/_media/bs/img/article/2019-02/14/full/1550162947-7329.jpg,2022-12-25T12:42:00Z,"India requires a corporate mandate on Research &amp; Development similar to CSR to promote a technology innovation culture which will help build critical technologies here in the country, Zoho Corpor… [+2367 chars]"
37,"{'id': None, 'name': 'iLounge'}",Samantha Wiley,Save $49 on the Apple Watch Series 8,"Apple’s latest flagship smartwatch offers good value for your money. Today, the Apple Watch Series 8 45mm GPS model is down to just $379.99 ... Read more",https://www.ilounge.com/news/apple-watch/save-49-on-the-apple-watch-series-8,https://www.ilounge.com/wp-content/uploads/2022/12/Apple-Watch-3.png,2022-12-25T12:32:34Z,"Apple’s latest flagship smartwatch offers good value for your money. Today, the Apple Watch Series 8 45mm GPS model is down to just $379.99 from its original price of $429 on Amazon.
The Apple Watch… [+677 chars]"
38,"{'id': 'la-repubblica', 'name': 'La Repubblica'}",repubblicawww@repubblica.it (Redazione Repubblica.it),"Firenze Fiera, a marzo la sesta edizione di Didacta dedicata all'innovazione scolastica",Torna alla Fortezza da Basso la rassegna sulla formazione e lo sviluppo digitale della didattica,https://firenze.repubblica.it/cronaca/2022/12/25/news/firenze_fiera_didacata_marzo_2023_fortezza_da_basso_formazione_scuola_innovazione-380650989/,https://www.repstatic.it/content/localirep/img/rep-firenze/2022/12/25/123116618-8b44e5cf-ebc5-4c6d-8fea-2d504b7b1aba.jpg,2022-12-25T12:30:09Z,"Torna alla Fortezza da Basso di Firenze dall'8 al 10 marzo 2023 la sesta edizione di Didacta Italia, l'evento più importante e seguito dedicato alla formazione e all'innovazione scolastica, rivolto a… [+1870 chars]"
39,"{'id': None, 'name': 'Motley Fool'}",newsfeedback@fool.com (James Brumley),2 of 2022's Biggest Losers Could Be 2 of 2023's Biggest Winners,"If you can stomach above-average risk and volatility, two technology stocks are primed to bounce back from underserved sell-offs.",https://www.fool.com/investing/2022/12/25/2022-biggest-losers-could-be-2023-big-winners/,https://g.foolcdn.com/editorial/images/714080/rising-stock-charts.jpg,2022-12-25T12:30:00Z,"It's been a tough year for the broad market. It's been a downright miserable one, however, for a handful of technology stocks that were all the rage in 2021. Economic malaise is on the horizon, and i… [+4665 chars]"
40,"{'id': None, 'name': 'Slashdot.org'}",aglandpartners,Ag land partners LLC,"Address:121 F StWaterford, CA 95386Phone:209-409-4935Farm Management is where Agland Partners began its foundation recognizing the need for absentee landowners and investorsto partner with a comprehensive “hands-on” farming team that can manage its day-to-day…",https://slashdot.org/submission/17087798/ag-land-partners-llc,,2022-12-25T12:27:20Z,"Address:121 F StWaterford, CA 95386Phone:209-409-4935
Farm Management is where Agland Partners began its foundation recognizing the need for absentee landowners and investorsto partner with a compre… [+488 chars]"
41,"{'id': None, 'name': 'Seeking Alpha'}",Friso Alenus,MGM Resorts: Raise Your Bet For 2023,"MGM Resorts' Q3 results are topping pre-pandemic revenues, while the business in China is lagging behind. Read why I consider MGM to outperform in 2023.",https://seekingalpha.com/article/4566363-mgm-resorts-raise-your-bet-2023,https://static.seekingalpha.com/cdn/s3/uploads/getty_images/1136150765/image_1136150765.jpg?io=getty-c-w750,2022-12-25T12:21:39Z,"gionnixxx/iStock Unreleased via Getty Images
Writing about a stock pick of the following year is quite difficult as the time span is short and yet a lot of unpredictable things can happen.
 However… [+8249 chars]"
42,"{'id': 'abc-news', 'name': 'ABC News'}",LAURA UNGAR and ANIRUDDHA GHOSAL Associated Press,China's COVID-19 surge raises odds of new coronavirus mutant,Could the COVID-19 surge in China unleash a new coronavirus mutant on the world,https://abcnews.go.com/Technology/wireStory/chinas-covid-19-surge-spawn-new-coronavirus-mutant-95806198,https://s.abcnews.com/images/US/abc_news_default_2000x2000_update_16x9_992.jpg,2022-12-25T12:20:59Z,"Could the COVID-19 surge in China unleash a new coronavirus mutant on the world?
Scientists dont know but worry that might happen. It could be similar to omicron variants circulating there now. It c… [+3889 chars]"
43,"{'id': None, 'name': 'ActionNewsJax.com'}",LAURA UNGAR and ANIRUDDHA GHOSAL,China's COVID-19 surge raises odds of new coronavirus mutant,Could the COVID-19 surge in China unleash a new coronavirus mutant on the world,https://www.actionnewsjax.com/news/world/chinas-covid-19/E3TYF5MPUMVKEHADPNSNTXGNDY/,https://cmg-cmg-tv-10050-prod.cdn.arcpublishing.com/resizer/Akqm6Znl_zho-uEOXJbcFuAIao8=/1440x810/filters:format(jpg):quality(70)/cloudfront-us-east-1.images.arcpublishing.com/cmg/DHTSMPDQEI6F43URMLXJUCCB6A.jpg,2022-12-25T12:20:30Z,"Could the COVID-19 surge in China unleash a new coronavirus mutant on the world?
Scientists dont know but worry that might happen. It could be similar to omicron variants circulating there now. It c… [+4047 chars]"
44,"{'id': None, 'name': 'Business Standard'}",ANI,Microsoft employee mistakenly leaks new version of Notepad with tabs,"An employee of the American tech giant Microsoft has accidentally announced that Windows 11's Notepad app is getting a tabs feature.According to The Verge, an American technology news website, a photo of a version of Notepad with tabs was shared by the employ…",https://www.business-standard.com/article/technology/microsoft-employee-mistakenly-leaks-new-version-of-notepad-with-tabs-122122500474_1.html,https://bsmedia.business-standard.com/_media/bs/img/article/2021-07/20/full/1626719534-4617.jpg,2022-12-25T12:18:00Z,"An employee of the American tech giant Microsoft has accidentally announced that Windows 11's Notepad app is getting a tabs feature.
According to The Verge, an American technology news website, a ph… [+1463 chars]"
45,"{'id': None, 'name': 'Biztoc.com'}",theguardian.com,Aptamer: the York biotech working on precision cancer treatments,"Inside a science park lab next to the University of York, two clusters of robots are busy moving clear plates with mechanical arms as they screen many millions of molecules. The machines need only 24 hours to complete work that would usually take teams of hum…",https://biztoc.com/x/9057f347ee1e9dd2,https://c.biztoc.com/p/9057f347ee1e9dd2/og.webp,2022-12-25T12:16:05Z,"Inside a science park lab next to the University of York, two clusters of robots are busy moving clear plates with mechanical arms as they screen many millions of molecules. The machines need only 24… [+444 chars]"
46,"{'id': None, 'name': 'iLounge'}",Samantha Wiley,Grab the Latest 5th-Generation iPad Air at $99 Off,"Holiday is in full swing, and today you can buy the amazing iPad Air 5 at an equally amazing price. The 5th generation iPad ... Read more",https://www.ilounge.com/news/ipad/grab-the-latest-5th-generation-ipad-air-at-99-off,https://www.ilounge.com/wp-content/uploads/2022/12/Apple-iPad.png,2022-12-25T12:13:53Z,"Holiday is in full swing, and today you can buy the amazing iPad Air 5 at an equally amazing price. The 5th generation iPad Air with WiFi and 64GB storage is down to just $499.99 from its original pr… [+670 chars]"
47,"{'id': 'associated-press', 'name': 'Associated Press'}",By LAURA UNGAR and ANIRUDDHA GHOSAL - Associated Press,China's COVID-19 surge raises odds of new coronavirus mutant,Could the COVID-19 surge in China unleash a new coronavirus mutant on the world? Scientists don’t know but worry that might happen. It could be similar to omicron variants circulating there now. It could be a combination of strains. Or…,https://apnews.com/306b688d84e31a9462f82d0ead1f4584,https://bloximages.newyork1.vip.townnews.com/roanoke.com/content/tncms/assets/v3/editorial/d/df/ddfc5962-711f-5ce6-bb22-a47ad1b6c029/63a83ed48ac10.image.jpg?crop=1763%2C926%2C0%2C124&resize=1200%2C630&order=crop%2Cresize,2022-12-25T12:12:38Z,"By LAURA UNGAR and ANIRUDDHA GHOSAL - Associated Press
Could the COVID-19 surge in China unleash a new coronavirus mutant on the world?
Scientists dont know but worry that might happen. It could be… [+4180 chars]"
48,"{'id': None, 'name': 'Yahoo Entertainment'}",Simply Wall St,Here's What We Like About Micron Technology's (NASDAQ:MU) Upcoming Dividend,"It looks like Micron Technology, Inc. ( NASDAQ:MU ) is about to go ex-dividend in the next 4 days. The ex-dividend date...",https://finance.yahoo.com/news/heres-micron-technologys-nasdaq-mu-121015884.html,https://media.zenfs.com/en/simply_wall_st__316/18417098744f61302bf9dacf5ce08c74,2022-12-25T12:10:15Z,"It looks like Micron Technology, Inc. (NASDAQ:MU) is about to go ex-dividend in the next 4 days. The ex-dividend date is one business day before the record date, which is the cut-off date for shareho… [+4325 chars]"
49,"{'id': None, 'name': 'seattlepi.com'}","By LAURA UNGAR and ANIRUDDHA GHOSAL, Associated Press",China's COVID-19 surge might spawn a new coronavirus mutant,Could the COVID-19 surge in China unleash a new coronavirus mutant on the world? Scientists don't know but worry that might happen. It could be similar to omicron variants circulating there now. It could be a combination of strains. Or something entirely diff…,https://www.seattlepi.com/news/article/China-s-COVID-19-surge-might-spawn-a-new-17676694.php,https://s.hdnux.com/img/modules/siteheader/brand.png,2022-12-25T12:09:55Z,"FILE - Masked commuters walk through a walkway in between two subway stations as they head to work during the morning rush hour in Beijing, Tuesday, Dec. 20, 2022. China continues to adapt to an easi… [+4669 chars]"
50,"{'id': None, 'name': 'CNA'}",,"China must raise self-reliance in agricultural technology, says President Xi Jinping","BEIJING: President Xi Jinping wants China to accelerate efforts to achieve self-reliance in agricultural technology, identifying seed development and core equipment among areas to focus on, state media reported. The central leadership had said in 2020 that th…",https://www.channelnewsasia.com/asia/china-must-raise-self-reliance-agricultural-technology-says-president-xi-jinping-3167546,"https://onecms-res.cloudinary.com/image/upload/s--i7HD1yUO--/fl_relative,g_south_east,l_one-cms:core:watermark:ap_data-1,w_0.1/f_auto,q_auto/c_fill,g_auto,h_676,w_1200/v1/one-cms/core/ye_2022_notebook_chinas_challenges_56014.jpg?itok=D_SL-Op7",2022-12-25T12:09:00Z,"BEIJING: President Xi Jinping wants China to accelerate efforts to achieve self-reliance in agricultural technology, identifying seed development and core equipment among areas to focus on, state med… [+946 chars]"
51,"{'id': None, 'name': 'Biztoc.com'}",wsj.com,"Sensor Tower: Pinduoduo's marketplace Temu gained 10.8M installations in the US since Sep. 1, and became the most downloaded US app between Nov. 1 and Dec. 14","As inflation and recession concerns squeeze American consumers, many are turning to a new mobile app with Chinese roots. Online shopping site Temu has soared in popularity in the U.S. since its launch in September. The rapid growth of the site, which sells ul…",https://biztoc.com/x/2b8221c40c008c5b,https://c.biztoc.com/p/2b8221c40c008c5b/og.webp,2022-12-25T12:08:06Z,"As inflation and recession concerns squeeze American consumers, many are turning to a new mobile app with Chinese roots.
Online shopping site Temu has soared in popularity in the U.S. since its laun… [+313 chars]"
52,"{'id': None, 'name': 'FX Empire'}",Reuters,"China must raise self-reliance in agricultural technology, Xi says","BEIJING (Reuters) -   President Xi Jinping wants China to accelerate efforts to achieve self-reliance in agricultural technology, identifying seed development and core equipment among areas to focus on, state media reported.",https://www.fxempire.com/news/article/china-must-raise-self-reliance-in-agricultural-technology-xi-says-1239823,https://responsive.fxempire.com/width/600/webp-lossy-70.q50/_fxempire_/2022/12/tagreuters.com2022newsml_LYNXMPEIBO0231.jpg,2022-12-25T12:06:59Z,"It is necessary to keep an eye on the frontiers of the worlds agricultural science and technology, the official Xinhua news agency quoted Xi as saying at the central rural work conference held in Bei… [+619 chars]"
53,"{'id': None, 'name': 'Toronto Star'}",Laura Ungar And Aniruddha Ghosal - The Associated Press,China’s COVID-19 surge raises odds of new coronavirus mutant,Could the COVID-19 surge in China unleash a new coronavirus mutant on the world?,https://www.thestar.com/news/world/2022/12/25/chinas-covid-19-surge-might-spawn-a-new-coronavirus-mutant.html,https://images.thestar.com/Al_UH_SgnhLRg-8VhfFwcYHRcMY=/1280x1024/smart/filters:cb(1671970636935):format(webp)/https://www.thestar.com/content/dam/thestar/news/world/2022/12/25/chinas-covid-19-surge-raises-odds-of-new-coronavirus-mutant/2022122507124-63a83cb6821cf083b82f8481jpeg.jpg,2022-12-25T12:06:22Z,"Could the COVID-19 surge in China unleash a new coronavirus mutant on the world?
Scientists dont know but worry that might happen. It could be similar to omicron variants circulating there now. It c… [+4224 chars]"
54,"{'id': None, 'name': 'WSLS 10'}","Laura Ungar And Aniruddha Ghosal, Associated Press",China's COVID-19 surge might spawn a new coronavirus mutant,Could the COVID-19 surge in China unleash a new coronavirus mutant on the world.,https://www.wsls.com/news/world/2022/12/25/chinas-covid-19-surge-might-spawn-a-new-coronavirus-mutant/,"https://res.cloudinary.com/graham-media-group/image/upload/f_auto/q_auto/c_thumb,w_700/v1/media/gmg/RKCAUFJDHBHLBOHMMEQACSRXHU.jpg?_a=ATO2Bfe0",2022-12-25T12:04:53Z,"Could the COVID-19 surge in China unleash a new coronavirus mutant on the world?
Scientists dont know but worry that might happen. It could be similar to omicron variants circulating there now. It c… [+4053 chars]"
55,"{'id': 'independent', 'name': 'Independent'}",Laura Ungar and Aniruddha Ghosal,China's COVID-19 surge might spawn a new coronavirus mutant,Could the COVID-19 surge in China unleash a new coronavirus mutant on the world,https://www.independent.co.uk/news/china-ap-covid-scientists-experts-b2251300.html,https://static.independent.co.uk/2022/12/25/12/Virus_Outbreak_China_Variants_10750.jpg?quality=75&width=1200&auto=webp,2022-12-25T12:04:53Z,"For free real time breaking news alerts sent straight to your inbox sign up to our breaking news emails
Sign up to our free breaking news emails
Could the COVID-19 surge in China unleash a new coro… [+4046 chars]"
56,"{'id': None, 'name': 'Yahoo Entertainment'}",LAURA UNGAR and ANIRUDDHA GHOSAL,China's COVID-19 surge raises odds of new coronavirus mutant,"Could the COVID-19 surge in China unleash a new coronavirus mutant on the world?  Every new infection offers a chance for the coronavirus to mutate, and the ...",https://news.yahoo.com/chinas-covid-19-surge-might-120452329.html,https://s.yimg.com/ny/api/res/1.2/ropnx..lKXG8wUGb8yolwg--/YXBwaWQ9aGlnaGxhbmRlcjt3PTEyMDA7aD04MDA-/https://media.zenfs.com/en/ap.org/abe01a941a4faf88b4f2f2f7a34f5a55,2022-12-25T12:04:52Z,"Could the COVID-19 surge in China unleash a new coronavirus mutant on the world?
Scientists dont know but worry that might happen. It could be similar to omicron variants circulating there now. It c… [+3894 chars]"
57,"{'id': 'the-times-of-india', 'name': 'The Times of India'}",Reuters,China must raise self-reliance in agricultural technology: Xi Jinping,"The President urged China's agricultural sector to ""vigourously improve"" its science and technology, with more efficient innovation. Xi urged the sector to address issues with innovation, such as the rate of conversion into commercial applications and a lack …",https://economictimes.indiatimes.com/news/international/world-news/china-must-raise-self-reliance-in-agricultural-technology-xi-jinping/articleshow/96497345.cms,"https://img.etimg.com/thumb/msid-96497367,width-1070,height-580,imgsize-19954,overlay-economictimes/photo.jpg",2022-12-25T12:04:14Z,"President Xi Jinping wants China to accelerate efforts to achieve self-reliance in agricultural technology, identifying seed development and core equipment among areas to focus on, state media report… [+1032 chars]"
58,"{'id': None, 'name': 'Business Standard'}",Press Trust of India,Sensex navigates geopolitical gyrations to outshine global peers,"After a two-year liquidity-fuelled bull run, the BSE Sensex faced its moment of reckoning in 2022 as Russia marched into Ukraine, the US Federal Reserve came out all guns blazing in its war against inflation and a cataclysm engulfed global financial markets.
…",https://www.business-standard.com/article/markets/sensex-navigates-geopolitical-gyrations-to-outshine-global-peers-122122500494_1.html,https://bsmedia.business-standard.com/_media/bs/img/article/2022-12/16/full/1671165580-2522.jpg,2022-12-25T12:04:00Z,"After a two-year liquidity-fuelled bull run, the BSE Sensex faced its moment of reckoning in 2022 as Russia marched into Ukraine, the US Federal Reserve came out all guns blazing in its war against i… [+6771 chars]"
59,"{'id': None, 'name': 'Forbes'}","Paul Iddon, Contributor, 
 Paul Iddon, Contributor
 https://www.forbes.com/sites/pauliddon/",'Knocking Down' Ukraine's Patriot Battery Would Give Russia A Much-Needed Propaganda Coup,Such an attempt could succeed for one primary reason.,https://www.forbes.com/sites/pauliddon/2022/12/25/knocking-down-ukraines-patriot-battery-would-give-russia-a-much-needed-propaganda-coup/,https://imageio.forbes.com/specials-images/imageserve/63a71f1e59cd91ad131d7c75/0x0.jpg?format=jpg&width=1200,2022-12-25T12:00:35Z,Russian President Vladimir Putin has declared Russia will destroy the MIM-104 Patriot air defense missile system the United States is delivering to Ukraine. Striking the single most advanced system t… [+5760 chars]
60,"{'id': None, 'name': 'Rigzone'}",Bloomberg News,Soaring China Covid Cases Push Economic Activity Off a Cliff,China's soaring Covid infections are keeping people home.,https://www.rigzone.com/news/wire/soaring_china_covid_cases_push_economic_activity_off_a_cliff-25-dec-2022-171509-article/,https://images.rigzone.com/images/news/articles/Soaring-China-Covid-Cases-Push-Economic-Activity-Off-a-Cliff-171509-582x327.png,2022-12-25T12:00:01Z,"China’s soaring Covid infections are keeping people home and causing a slump in travel and economic activity, according to the latest high-frequency data.
Following the recent abrupt end to Covid Ze… [+4240 chars]"
61,"{'id': None, 'name': 'CNBC'}",TipRanks.com Staff,Top Wall Street analysts say buy these stocks in a challenging 2023,"TipRanks analyst ranking service pinpoints Wall Street's best-performing stocks, including Amazon and Costco.",https://www.cnbc.com/2022/12/25/top-analysts-say-buy-costco-amazon-in-2023.html,https://image.cnbcfm.com/api/v1/image/106428862-1583499472194rts3427o.jpg?v=1671973201&w=1920&h=1080,2022-12-25T12:00:01Z,"Shoppers line up outside a Costco to buy supplies after the Hawaii Department of Health on Wednesday advised residents they should stock up on a 14-day supply of food, water and other necessities for… [+6402 chars]"
62,"{'id': None, 'name': 'The Guardian'}",Julia Kollewe,Aptamer: the York biotech working on precision cancer treatments,"UK firm links with up global drug firms to make synthetic antibodies capable of binding to targets such as tumour cellsInside a science park lab next to the University of York, two clusters of robots are busy moving clear plates with mechanical arms as they s…",https://www.theguardian.com/business/2022/dec/25/aptamer-york-biotech-cancer-treatments,https://i.guim.co.uk/img/media/c432d7fd0efbb0e3e3f54a59ca1643f5182c7ea7/0_0_7997_4798/master/7997.jpg?width=1200&height=630&quality=85&auto=format&fit=crop&overlay-align=bottom%2Cleft&overlay-width=100p&overlay-base64=L2ltZy9zdGF0aWMvb3ZlcmxheXMvdGctZGVmYXVsdC5wbmc&enable=upscale&s=1785cefc75c548383a8eb88deaa7dfb6,2022-12-25T12:00:00Z,"Inside a science park lab next to the University of York, two clusters of robots are busy moving clear plates with mechanical arms as they screen many millions of molecules. The machines need only 24… [+7600 chars]"
63,"{'id': None, 'name': 'Forbes'}",Gene Marks,Your Best Chromebook Deals…And Other Small Business Tech News This Week - Forbes,"Chomebook deals, Apple productivity hacks and whether or not Mastodon is right for your business makes up this week's small business technology news.",https://www.forbes.com/sites/quickerbettertech/2022/12/25/your-best-chromebook-dealsand-other-small-business-tech-news-this-week/,https://imageio.forbes.com/specials-images/imageserve/63a5aae912182b0d0fcc7317/0x0.jpg?format=jpg&width=1200,2022-12-25T12:00:00Z,(Photo by Smith Collection/Gado/Getty Images)
64,"{'id': None, 'name': 'Washington Examiner'}",Sarah Westwood,Republicans divided on fight to take on Big Tech - Washington Examiner,Most Republicans readily agree they should use their forthcoming House majority to take on the so-called Big Tech companies that dominate everything from social media to online shopping.,https://www.washingtonexaminer.com/policy/technology/fight-big-tech-threatens-divide-republicans,https://mediadc.brightspotcdn.com/dims4/default/11bced2/2147483647/strip/true/crop/2290x1202+0+64/resize/1200x630!/quality/90/?url=http%3A%2F%2Fmediadc-brightspot.s3.amazonaws.com%2F28%2Fcc%2Ff2d5fc2340c89f1bf6a3fbd4ed0e%2Fjosh-hawley.jpg,2022-12-25T12:00:00Z,"Most Republicans readily agree they should use their forthcoming House majority to take on the so-called Big Tech companies that dominate everything from social media to online shopping. 
But many d… [+5287 chars]"
